job_id,job_title,company_name,location,time_posted,num_applicants,description
4087075711,BI Business Analyst,Otto International,"Ho Chi Minh City, Vietnam",1 week ago,176 applicants,"In Otto International, It starts with us; Our outstanding products and services are made possible by our most valuable resource: our people. It is their skills, passion, and precision that empower our excellent, customer-centric solutions.
We are searching for a 
BI Business Analyst
 who will be supporting us to transition our business into a fully digitized and data-driven business model. You will be part of the team that operates leading BI application (Qlik Cloud) and that creates the conditions for improved decisions and processes with their analyses and reports. Our BI team is a global team working from Hong Kong, Ho Chi Minh City and Hamburg.
You will work on reports, analysis and dashboards mainly in Qlik Cloud to support management, key accounts and operational teams in their decision-making.
How will you make a difference?
Communicate with stakeholders (management, key accounts and customers) to understand their requirements.
Translate business processes into data structure and reporting requirements.
Define and analyse report specifications.
Design efficient reports in BI systems to meet business and technology needs.
Coordinate with Data Engineers to build and implement complex data model. Develop data models yourself.
Fulfil ad hoc report requirements by Management.
Develop and implement test concepts to ensure implementation quality.
Analyse and correct errors.
Provide advice and training to end user.
Prepare system and training documents, such as user manual, training materials and slides.
Gather feedback from end users about system performance.
Promote BI strategy in the company.
Keep abreast of BI trends and developments.
Who we are looking for?
Degree holder in Business Administration, Data Management, Information Technology or related disciplines.
At least 3 – 5 years of hands-on experience in consulting, business analysis and/or similar position.
Strong knowledge of QLIK Sense, Qlik Cloud or any other BI tools.
Additional experience with other BI and Data Lake applications would be a plus.
Familiarity in Apparel Sourcing and Logistics processes is an advantage.
Self-directed, organised, results-oriented, strong passion for driving creativity and backing changes.
Good communication skills in English (written and spoken).
Why work with us?
Collaborative, fun and challenging work environment.
Open, transparent and diverse culture with locations worldwide.
Double-pay, performance bonus, flexible working hours.
Full healthcare insurance coverage.
All data provided by applicants will be treated in strict confidence and used solely for recruitment purposes."
4087298409,Data Engineer,WorldQuant,"Ho Chi Minh City, Ho Chi Minh City, Vietnam",2 weeks ago,127 applicants,"WorldQuant develops and deploys systematic financial strategies across a broad range of asset classes and global markets. We seek to produce high-quality predictive signals (alphas) through our proprietary research platform to employ financial strategies focused on market inefficiencies. Our teams work collaboratively to drive the production of alphas and financial strategies – the foundation of a balanced, global investment platform.
WorldQuant is built on a culture that pairs academic sensibility with accountability for results. Employees are encouraged to think openly about problems, balancing intellectualism and practicality. Excellent ideas come from anyone, anywhere. Employees are encouraged to challenge conventional thinking and possess an attitude of continuous improvement.
Our goal is to hire the best and the brightest. We value intellectual horsepower first and foremost, and people who demonstrate an outstanding talent. There is no roadmap to future success, so we need people who can help us build it.
The Role: 
The Data Engineer plays a pivotal role in the development of our data systems. A successful candidate will design, implement, test, deploy, and monitor production data pipelines using MLOps methodology in close collaboration with other teams. The candidate will need to quickly learn and apply new cutting-edge technologies, focusing on Large Language Models (LLM). The goal is to produce agile, scalable, and fault-tolerant systems as we grow in size and sophistication. This person will follow coding best practices, participate in code and design reviews, and advocate for coding excellence.
What You’ll Bring
Degree in a quantitative or technical discipline (computer science, engineering, etc.)
At least 2 years’ experience in developing and managing scalable and robust data pipelines
Have a deep understanding of machine learning and experience in training, inference, and evaluation.
Excellent Python coding skills; familiarity with pandas & Spark is required
Strong analytical skills and attention to detail
Excellent communication skills in both verbal and written form
Ability to operate in a collaborative, team-oriented culture
Proactive and mature approach to problem-solving and project management
Experience with Kubernetes (k8s) for deployment is preferred 
Experience with monitoring and alerting tools is preferred 
Experience with LLM technologies (OpenAI-compatible, llama.cpp, vllm) is preferred 
Familiarity with infrastructure management and deployment and ML Ops is preferred 
What We Offer
Competitive and attractive compensation package with clear career road-map – where you feel challenged everyday
We offer a strong culture of learning and development: training courses, library, speakers, share and learn events
Learn from who sits next to you! Working in WQ you are surrounded by smart and talented people
Employee resources groups with strong diversity and inclusion culture
Premium Health Insurance and Employee Assistance Program
Generous time-off policy, re-creation sabbatical leave (based on tenure), Trade Union benefits for staff and family
Team building activities every month: Local engagement events, monthly team lunch – Employee clubs: football, ping-pong, badminton, yoga, running, PS5, movies, etc.
Annual company trip and occasional global conferences – opportunity to travel and connect with our global teams
Happy-hour with tea break, snacks and meals every day in the office!
By submitting this application, you acknowledge and consent to terms of the WorldQuant Privacy Policy. The privacy policy offers an explanation of how and why your data will be collected, how it will be used and disclosed, how it will be retained and secured, and what legal rights are associated with that data (including the rights of access, correction, and deletion). The policy also describes legal and contractual limitations on these rights. The specific rights and obligations of individuals living and working in different areas may vary by jurisdiction.
Copyright © 2025 WorldQuant, LLC. All Rights Reserved.
WorldQuant is an equal opportunity employer and does not discriminate in hiring on the basis of race, color, creed, religion, sex, sexual orientation or preference, age, marital status, citizenship, national origin, disability, military status, genetic predisposition or carrier status, or any other protected characteristic as established by applicable law."
4083818324,Data Engineer,UrBox - Digital Rewards & Loyalty Solution,"Ho Chi Minh City, Ho Chi Minh City, Vietnam",3 months ago,74 applicants,"Location: Ho Chi Minh
Expired date: 31/12/2024
Team: Engineering
Description
Design/ maintain/develop the ETL process to complete data migration from another platform to our cloud DWH ( Build on AWS redshift)
Develop procedures & scripts to optimize the ETL process
Design, structure & develop data marts that support BI & analytics purpose
Work with internal stakeholders to generate data mapping document, data dictionary
Coordinate with internal stakeholders to ensure data quality & improve data flow by business operation
Assist in technical direction for internal data model
Other tasks as an assignment 
Requirement
2+ years experience as Data Engineer, working with databases, coding to intake, clean, transforming data
Proficient working with MySQL/MongoDB/Cloud AWS database
Proficient use ETL tool as Airflow
Proficient python/Ubuntu
Experience developing automation tool to automate data migration
Proactive, adaptable, detail-oriented & well organize
Ability to work under pressure in a fast-paced environment
Application form
Full Name *
Email Address *
Phone Number *
More information
Your Resume *
To attach your Resume, click here to upload from your Computer.
Security code *
Submit
Related jobs
Senior Data Engineer
Full-Stack Engineer
[HCM] Product Manager
Data Engineering Lead
Frontend Engineer (ReactJS/React Native)
All jobs"
4055933116,Data Engineering Intern,ShopBack,Ho Chi Minh City Metropolitan Area,5 days ago,,"Our Journey
ShopBack started as a spark of inspiration one night in 2014 when Henry and Joel were brainstorming ideas in Henry’s car. That lightbulb moment — earning Cashback while shopping online — was just the beginning. Fueled by the countless possibilities, the team locked themselves in a hotel room for 24 hours to code the very first prototype. Their mission? To revolutionize shopping by helping advertisers market more cost-effectively, while making every purchase more rewarding for shoppers.
Today, ShopBack is the leading shopping, rewards, and payments platform in Asia-Pacific, empowering 45 million shoppers across 12 markets. With 20,000+ partners and over half a million transactions daily, we’re redefining the way the world shops. As we expand globally, we’re looking for adventurous, driven individuals to help us build 
The World’s Most Rewarding Way to Shop
 .
Your Adventure Ahead
Work on a variety of data engineering projects, including data cleaning, data transformation, and data modeling
Work with our team of data engineers to develop and implement data-driven solutions
Develop and maintain data pipelines
Analyze and visualize data
Write SQL and Python code
Collaborate with other team members
Stay up-to-date on the latest data engineering technologies
Essentials To Succeed
Majoring in Software Engineering, Computer Science, Data Science, or a related field
Solid understanding of SQL and Python
Excellent problem-solving and analytical skills
Strong communication and teamwork skills
Ability to work independently and as part of a team
ShopBackers' DNA
Grit - 
 We tackle all challenges head-on, working together to solve problems and achieve success.
Hunger 
 - We value hard work, and having relentless drive.
Speed - 
 We move fast and have a bias for action, all to deliver maximum impact.
Impact - 
 We focus on results, always aiming for the best possible outcomes and timelines.
Growth -
 We embrace a growth mindset, constantly striving to learn, improve, and excel in our roles.
Exclusively for ShopBackers
Career progression paths
 and opportunities to take on greater challenges that help you realise your ambitions.
Be part of a winning team 
 on a journey to global scale.
Competitive compensation
 based on your performance.
Candid, open, and collaborative culture
 where feedback is valued, for everyone to grow and improve every day.
ShopBack is an equal opportunity employer. We celebrate diversity and are committed to creating an inclusive environment for all employees. We do not discriminate on the basis of race, color, religion, sexual orientation, national origin, age, disability, genetic information, veteran status, or any other protected status under applicable laws. Join our team and help us make a difference!
 We are committed to protecting your data and ensuring fairness in our recruitment process. As part of this process, we use AI tools to assist with tasks such as application screening and candidate matching. These tools are designed to enhance efficiency and reduce bias, and their use complies with applicable data protection laws and our commitment to fair employment practices. Your personal data will be processed securely and transparently, and final hiring decisions are always made by our recruitment team, not by automated systems. If you have any questions about how your data is used, or wish to exercise any of your rights including the right to such processing, please contact us at dpo@shopback.com ."
4146527302,Senior Data Analyst (40000032),Techcombank (TCB),Ho Chi Minh City Metropolitan Area,2 weeks ago,36 applicants,"Job Purpose
 The job holder advises and provides business with insights from massive amounts of structured and unstructured potential data to help shape or meet specific business objectives.
 The job holder will build data science solutions using advance machine learning and deep learning methods, recommendation engines, statistical analysis, data mining and data visualization techniques, to create solutions that enable enhanced business performance.
Key Accountabilities (1)
Data Solutioning
 Build algorithms and work with machine learning and deep learning tools to deliver advance analytics solutions across the firm including recommendation engines, customized data models, customer journeys, graph modes, etc.
 Mine and analyze data from company’s databases to drive optimization and improvement of business strategies.
 Use predictive modelling to increase and optimize customer journey experiences, revenue generation and other business outcomes.
 Analyze data for trends and patterns and interpret the data with clear objective in mind.
 Execute and review data science projects in an agile manner and in compliance with internal regulatory requirements.
Key Accountabilities (2)
Data Insighting
 Lead the identification and interpretation of meaningful and actionable insights from large data and metadata sources.
 Develop processes and tools to monitor and analyze model performance and data accuracy.
 Interact with 1-2 squads to identify questions and issues for data analysis.
 Assess the effectiveness and accuracy of new data sources and data gathering techniques.
Key Accountabilities (3)
Key Relationships - Direct Manager
Manager, Data Science
Key Relationships - Direct Reports
Key Relationships - Internal Stakeholders
Teams within the Transformation Office and relevant departments in the Bank
Key Relationships - External Stakeholders
Partners providing professional services
Success Profile - Qualification and Experiences
Qualifications
 Bachelor's degree in Statistics, Mathematics, Quantitative Analysis, Computer Science, Software Engineering or Information Technology
Work Experience
 5+ years of relevant experience in areas of data analysis, machine learning, deep learning model development on large amount of data, implementing and deploying various statistical models
 English proficiency requirements are pursuant to Techcombank's policy
 Experience in querying databases and using programming languages (e.g. C, C++, R, Python, Scala, SQL, Java, Tableau, R)
 Experience communicating complex analysis and models across a diverse team
 Experience using of data optimization (linear / non-linear) to solve constrained business problems
 Understanding of Agile principles, practices and Scrum methodologies
 Experience working in Agile teams to support digital transformation projects"
4143150305,"Power BI Developer (Data Analyst, SQL, English) - Vietnamese only",Havas,"Ho Chi Minh City, Vietnam",3 weeks ago,82 applicants,"Ekino, powered by HavasCX, is a French company specialised in Conception, Design, Development and Maintenance of digital solutions: Digital Platforms, Websites, Mobile Applications.
We are part of the Havas/ Vivendi Group. We work with other agencies in the network or directly with Asian, European and American clients.
HavasCX is the global network brand, bringing together over 1,200 specialists in digital transformation, eCommerce, customer experience design and customer acquisition and engagement from Havas’ global and local agencies.
We build innovative solutions from the ground up with open technologies. Our solutions are integrated with legacy systems (e-commerce, billing, provisioning, leads, CRM,...) and help business and digital managers to meet their objectives.
We provide our services to large French and international groups. Projects range from 50 to 1000 days of development.
The Ekino Group is composed of 700 consultants and technical experts, located in France (Paris & Bordeaux), Vietnam (Ho Chi Minh City), United Kingdom (London), Singapore, India and USA (New York).
ekino in Vietnam 
Ekino has been operating in Ho Chi Minh City since 2013, with around 200 employees.
 
We are specialised in Sage X3, Digital Architecture, eCommerce, Web Platforms, Mobile and Responsive Apps; Agile Development; ReactJS; AngularJS; NodeJS; Java; .Net; PHP (Symfony, WordPress, Drupal, Magento 2), User Experience, User Interface, Service Design; Cloud Services, DevOps.
Power BI Developer
 
Job description
 
The Power BI developer will be responsible for translating business requirements into actionable insights via designing, developing, and maintaining business intelligence solutions using Power BI platform. The duties include but not limited to: 
Gather and analyze requirements, come up with adequate technical design and effective BI solutions. 
Create data models for data transformation
, cleaning, shaping for meaningful insights and analysis. 
Use Power BI to design and develop 
interactive, well-presented reports
, 
dashboards
, and 
data visualizations
. 
Maintain, review, and update existing Power BI reports
 to reflect changes in data sources, business requirements, and user needs. 
Optimize report performance
 by fine-tuning data models, implementing best practices, and considering data refresh strategies. 
 
Reporting line 
 
Report to the Technical Manager and the Project Manager. 
 
Desired Skills and Experience
 
Bachelor's Degree in Computer Science, Information Technology, Statistics or equivalent major. 
3+ years of experience
 as a 
Power BI developer
 or similar roles. 
Solid understanding of data analysis concepts, data visualization best practices, and business intelligence principles. 
Proficiency in 
Power BI
, including Power Query,
 DAX
, and 
report/dashboard development
. 
Strong 
SQL skills
 and experience with relational databases. 
Knowledge of Python or R for data manipulation is a plus. 
Effective communication in 
English (intermediate level and above) 
and Vietnamese. 
Strong analytical, problem-solving skills and attention to detail. 
Advantageous to have experience and/or knowledge regarding: 
data integration, data warehousing concepts, and Azure environment. 
Microsoft Power BI certification(s). 
 
Why ekino?
 
High-ownership working environment: You will take full responsibility and control of your missions contributing to the team's success 
Continuous skill improvement with new technologies, challenging projects, on-the-job coaching, and training programs 
Annual performance review & bonus: recognize your efforts and identify development/ improvement needs 
Clear career path: define your career development with long-term vision 
Be secured in your mind with employee’s care: private healthcare insurance package, medical check-up, support allowance... 
Great-place-to-work activities (company trip, sport clubs...): enhance teamwork spirit and facilitate your work-life harmony 
 
Websites: 
https://www.ekino.vn/career/
; 
https://www.ekino.vn/
 
To apply for this position, please send your English CV with an attached 
professional photo
 to: 
careers@ekino.vn
 
 
Thank you for your time and enthusiasm in our career opportunities.
Please kindly note that shortlisted candidates will be contacted within 3 weeks of application. Alternatively, we will reach out to you when another suitable chance arises in the future."
4106841823,[LiveOps Team] Product Data Analyst (Based in HCM),Amanotes,"Ho Chi Minh City, Ho Chi Minh City, Vietnam",2 months ago,174 applicants,"Objective
As an Amanotes’ product Data Analyst, you have the chance to deal with data of 3+ billion users to generate accurate, actionable, and timely insights for the products team, in order to boost user understanding and product optimization
What You Will Do
Answer business questions, such as pattern recognition of user behavior, product optimization, and monetization opportunities…, by extracting, manipulating, and analyzing data while applying statistical techniques.
Work closely with the Product and Monetization team in planning and daily operation to identify opportunities for other data solutions, provide insight and consult on action for product optimization.
Construct dashboards to monitor business performance, create and maintain data documentation.
Automate repeating data works with frameworks and tools to reduce ad hoc tasks.
Build, optimize and ensure the quality of data / ETL pipeline with the Central Data team.
Qualifications
Be fluent in SQL for data pipeline building, ad-hoc requests, and debugging
Be able to use standard statistical & analytical techniques: A/B testing - Hypothesis testing, cohort analysis, correlation, segmentation,...
Be able to communicate data findings with appropriate examples from data points of view, using proper visualization (bar, line, histogram, bubble chart...)
Be able to give clear and actionable recommendations based on data findings
Have a good command of critical/logical/analytical thinking & problem-solving skills
Be fast, proactive, and have good learning agility
Experience with the following is appreciated: Maths and Statistics (especially Statistical Inference), SQL, Python, and Data visualization tools
Nice to have:
Basic understanding of mobile app/mobile-game industry and good command of English
Having basic knowledge of machine learning is a plus
Benefits
At Amanotes, you will be enjoying the dynamic working environment with unique music culture many benefits as below:
Competitive salary upon experience
13th month salary
Annual Performance Bonus
Flexible working time
Personal learning and well-being budget
Team-building budget
Lunch and parking allowance
Various learning activities, including internal training & sharing, international conferences, and e-learning (Udemy, Linkedin Learning...)
Engaging music events: Music Night, Amasing Night, Music schools…
Employee Assistance Program to support mental health & well-being
Minimum 12 days of paid annual leave, plus 10 days of paid sick leave
12 days working from home per year
Attractive relocation package (for several positions)
About Amanotes
We are Amanotes - a dynamic interactive music company that's using cutting-edge technology to transform how people experience music. Since 2014, we have dominated the global simple music game market with over 3.5 billion downloads on over 190 countries. Our portfolio includes chart-topping music games like Magic Tiles 3, Tiles Hop, Dancing Road, Duet Cats.
As the world’s top Music Game Publisher and top App Publisher from Southeast Asia by downloads. Our ambition is to create the world’s iconic hybrid casual music games that people play for years
Come join our music-filled workplace and let's create a magical music experience!
How To Apply?
Click the button or contact us at talents@amanotes.com."
