job_id,job_title,company_name,location,time_posted,num_applicants,description
4158731347,SQL Developer,Deel,Ho Chi Minh City Metropolitan Area,6 days ago,64 applicants,"Who We Are Is What We Do.
Deel and our family of growing companies are made up of global teams dedicated to helping businesses hire anyone, anywhere, easily.
The team comprises over three thousand self-driven individuals spanning over 100 countries, and our unified yet diverse culture keeps us continually learning and innovating the platform and products for customers.
Companies should be able to hire the best talent anywhere in the world, so we are building the best platform to make that a reality. Our market-leading technology, expertise, and global team are crucial to the platform’s success. We deliver the best products and features in our space, enabling millions of jobs worldwide and connecting the global workforce with the best companies and opportunities.
Why should you be part of our success story?
A 30-mile hiring radius should no longer dictate how companies hire because exceptional talent lives everywhere. Deel sees a world without hiring borders and endless talent that pairs perfect candidates with great companies.
We offer global teams all the tools they need to hire, onboard, manage, pay, and scale at full speed. We aim to foster a diverse global economy by building a generational platform that seamlessly connects companies with talent worldwide.
After our successful Series D in 2021, we raised another $50M in 2023, doubling our valuation to $12B. There’s never been a more exciting time to join Deel — the international payroll and compliance market leader.
About The Role
As a SQL Developer you will be responsible for designing, developing, and maintaining reports that provide valuable insights and legislative information to support various client requirements. You will collaborate with various departments to understand their reporting needs, analyse data sources, and create visually appealing and accurate reports. The role involves utilizing report writing tools, database systems, and programming languages to ensure the effective extraction, transformation, and presentation of data.
Responsibilities: 
Ensures customer excellence: 
 Builds and maintains strong relationships with internal customer base.
 Lives the company’s values and service standards with regards to customer interaction.
 Adheres to business processes and systems to meet the company’s quality requirements.
 Takes personal accountability for service excellence.
 Adheres to the company’s work standards.
Information security: 
 Understand their role within the organisation from an information security perspective and commit to protecting the organisation’s security information assets.
Finance:
 Ensures Cost savings and efficiencies in area of accountability.
Self- development:
 Update job knowledge by participating in educational opportunities; reading professional publications; maintaining personal networks; participating in professional organizations.
 Prepare personal development plans in conjunction with Manager and implement in line with business requirements.
Report writing
Requirement Analysis:
 Work closely with business stakeholders to gather and understand reporting requirements.
 Analyse data sources and determine the best approach for extracting and presenting relevant information.
Report Design and Development:
 Design and develop reports using report writing tools such as SSRS and DevExpress report writing tools.
 Develop SQL queries or use other programming languages to extract and manipulate data from databases.
Performance Optimization:
 Optimize report performance by identifying and resolving bottlenecks in data retrieval and processing.
 Implement best practices for efficient report execution.
Collaboration
:
 Collaborate with cross-functional teams, including IT, business analysts, and end-users, to ensure reports meet business requirements.
 Provide technical support to internal users as needed.
Quality Assurance:
 Conduct thorough testing of reports to ensure accuracy and reliability.
 Troubleshoot and resolve any issues identified during testing or production use.
Requirements: 
 Familiarity with at least one of the following programming languages: C# or VB.NET.
 Strong knowledge of SQL Server including stored procedures, views and functions and table design.
 Problem diagnosis and creative problem-solving skills.
 Strong organisational skills to juggle multiple tasks within the constraints of timelines.
 Ability to work and thrive in a fast-paced environment, learn rapidly.
 Ability to communicate effectively in a team environment.
 2 - 5 years of related experience.
Total Rewards
Our workforce deserves fair and competitive pay that meets them where they are. With scalable benefits, rewards, and perks, our total rewards programs reflect our commitment to inclusivity and access for all.
Some things you’ll enjoy
Provided computer equipment tailored to your role
Stock grant opportunities dependent on your role, employment status and location
Additional perks and benefits based on your employment status and country
The flexibility of remote work, including WeWork access where available
DISCLOSURE 
We use Covey as part of our hiring and/or promotional processes. As part of the evaluation process, we provide Covey with job requirements and candidate-submitted applications.Certain features of the platform may qualify it as an Automated Employment Decision Tool (AEDT) under applicable regulations. For positions in New York City, our use of Covey complies with NYC Local Law 144.
We began using Covey Scout for Inbound on the 19th of February, 2025.
For more information about our data protection practices, please visit our Privacy Policy.
You can review the independent bias audit report covering our use of Covey here: https://getcovey.com/nyc-local-law-144.
At Deel, we’re an equal-opportunity employer that values diversity and positively encourage applications from suitably qualified and eligible candidates regardless of race, religion, sex, national origin, gender, sexual orientation, age, marital status, veteran status, disability status, pregnancy or maternity or other applicable legally protected characteristics.
Unless otherwise agreed, we will communicate with job applicants using Deel-specific emails, which include @
deel.com
 and other acquired company emails like @
payspace.com
 and @
paygroup.com
. You can view the most up-to-date job listings at Deel by visiting 
our careers page
.
Deel is an equal-opportunity employer and is committed to cultivating a diverse and inclusive workplace that reflects different abilities, backgrounds, beliefs, experiences, identities and perspectives.
Deel will provide accommodation on request throughout the recruitment, selection and assessment process for applicants with disabilities. If you require accommodation, please inform our Talent Acquisition Team at recruiting@deel.com of the nature of the accommodation that you may require, to ensure your equal participation."
4164758591,"Senior Business Intelligence Analyst (Fraud/ Payment) - Business Intelligence & Planning, Shopee",Shopee,"Ho Chi Minh City, Ho Chi Minh City, Vietnam",1 day ago,,"Job Description
Evaluate and define business metrics, democratize data by building and socializing decision tools (dashboard, reports)
Work closely with business stakeholders (Fraud/ Payment) to conduct analysis that lead to actionable insights to grow the business and strengthen Operation performance. 
Consult business stakeholders to run analysis/data support that leads to actionable insights to grow/optimize the business
Support various business functions with the development and maintenance of various management reports
Requirements
From 3+ years of experience in Business Intelligence or Data Analytics role with proven business impact
Strong analytical thinking and ability to learn quickly with can do attitude
Excellence written and verbal communication skills in English and Vietnamese
Experience working with cross-functional teams to gather requirements and define the right metrics to describe the state of the business - both on a macro-level and a micro-level
Strong experience in SQL
Advanced Excel skills with knowledge in Power Query, Power Pivots
Knowing statistical programming language (Python, R) to manipulate and draw insights from large data sets is a plus"
4150037052,Senior Business Intelligence Analyst,Yes4All,"Ho Chi Minh City, Ho Chi Minh City, Vietnam",2 weeks ago,,"Yes4All is one of the leading brands for home sporting goods & furniture in the e-commerce market. Founded in 2010, we have strived to be in the top 1% retailers on Amazon US. Based in California with an operation office in HCMC, we have more than 400 young and talented members with expert knowledge and experience in the e-commerce industry.
We are on an ambitious journey to dominate not only Amazon‘s sporting goods market but also to enter new e-commerce markets from many regions like Canada, Europe, Japan. Besides, Home sporting goods, Furniture, Outdoor and Gardening are also great opportunities that we desire to occupy and create significant values. With our steady knowledge in E-commerce, Yes4All started to provide end to-end ecommerce-enabler service in order to help Vietnamese and global manufacturers or struggling sellers bring their products to the US & International markets.
Our mission:
 Connect the Worldwide Resources & create innovative platform to bring products and services from innovators and manufacturers to worldwide customers more efficiently.
Our vision:
 To be the world leader of e-commerce enabler in term of trading, product creating, and e-commerce servicing.
For More Information
Website: https://yes4all.com/ 
LinkedIn: www.linkedin.com/company/yes4all-llc/ 
Facebook: www.facebook.com/Yes4AllVNCareers 
Yes4All is strongly growing. On the way to become the world largest e-commerce enable platform, we are looking for talented candidates to join us.
Position Overview
The Senior Business Intelligence Analyst will play a crucial role in driving data-driven decision-making across the organization. This individual will be responsible for conducting in-depth data analysis, developing sophisticated BI reports and dashboards, and providing strategic insights to support business objectives
I. Job Description
Data Analysis and Insights: Conduct thorough analysis of data from various sources, including sales, marketing, and customer behavior, to identify trends, generate actionable insights, and support strategic initiative
Reporting and Dashboards: Design, develop, and maintain comprehensive and visually appealing dashboards and reports that facilitate data-driven decision-making across departments
Advanced Analytics: Utilize advanced analytical techniques, including statistical analysis and predictive modeling, to provide deeper insights into business performance
Cross-Functional Collaboration: Work closely with stakeholders from different departments (e.g., marketing, sales, technology) to understand their data needs and ensure alignment with overall business goals
Data Quality and Governance: Ensure the accuracy, integrity, and consistency of data by implementing and maintaining data quality and governance standards
Mentorship and Support: Provide guidance and support to junior analysts, fostering their development and enhancing the overall analytical capability of the team
Tool and Technology Optimization: Stay up-to-date with the latest BI tools and technologies, and recommend and implement improvements to enhance analytical processes
Ii. Skill And Experience
A bachelor‘s degree in Business, Economics, Computer Science, or a related field. Advanced degrees are a plus.
A minimum of 3 years of experience in a business intelligence or data analytics role, preferably within the e-commerce sector
Proficiency in BI tools (such as Power BI), along with strong SQL skills. Knowledge of programming languages like Python is the must. Familiarity with Airflow, Jenkins is a plus
Strong analytical and problem-solving skills, with the ability to translate complex data into actionable insights
Excellent communication and presentation skills, with the ability to convey data-driven insights to both technical and non-technical stakeholders
WHY YOU WILL LOVE JOINING US?
FOR YOU TO JOIN
Financial Well-being: A competitive salary with 13th month salary, annual performance bonus and a variety of allowances.
Salary review: annually or on excellent performance.
Activities: company trips, team-building, and other customized monthly bonding events.
Annual leaves: 16 days off and 01 Birthday Leave per year.
Healthcare: annual health check, insurance according to Labor Law and extra PTI Insurance package.
Working Environment: dynamic, friendly environments with working time flexibility (Mon-Fri), and other perks include snacks, coffee, and healthy food provided daily suited for hardworking, fun, and team collaboration.
FOR YOU TO GROW
Ambition: We are now keeping on with our hyper growth to multicategory, multichannel, multimarket, and expanding into the world largest e-commerce enabler. Hence, there will continuously be opportunities to challenge yourself, learn new skills and knowledge. 
Challenges: Your voice can always be heard as we embrace the eagerness of learning and sharing. You can be your own boss and create your own value with the ability to take initiative and make decisions in all aspects of work.
Chances: Be led and coached by experienced and inspirational leaders and participate in various training courses where you can enlarge your knowledge and experience in the E-commerce and Supply Chain industry.
FOR YOU TO STAY
People: Having a headquarter in the US and an operation office in Vietnam, our team is young and highly motivated. You will be working with and alongside members having experiences from International Corporations or high profile from Vietnam that share the same passion and dedication.
Culture: Our working environment is humble, collaborative and 100% healthy. We promote Exchange & Speak out, you can receive transparent and supportive feedback so you can perform the best.
Career path: Provide you a great career path, open to rotating for your better understanding of the company and contribute across many of our functions.
And much more, join us and let yourself explore other fantastic things!"
4156957946,Data Analytic Partner,Yes4All,"Ho Chi Minh City, Ho Chi Minh City, Vietnam",1 week ago,28 applicants,"Yes4All is one of the leading brands for home sporting goods & furniture in the e-commerce market. Founded in 2010, we have strived to be the world leader in e-commerce enablers in term of trading, product creating and e-commerce servicing. Based in California with an operation office in HCMC, we have more than 500 young and talented members with expert knowledge and experience in the e-commerce industry.
We are on an ambitious journey to dominate not only US e-commerce market but also to enter new e-commerce markets of more than 15 countries in Europe, Asia and North America, not only Amazon channel but also Walmart, Wayfair among others. Besides, Home sporting goods, Furniture, Outdoor and Gardening are also great opportunities that we desire to occupy and create significant values. With our steady knowledge in E-commerce, Yes4All started to provide end-to-end ecommerce-enabler service in order to help Vietnamese and global manufacturers or struggling sellers bring their products to the US & International markets.
Our mission: Connect the Worldwide Resources & create innovative platform to bring products and services from innovators and manufacturers to worldwide customers more efficiently.
Our vision: To be the world leader of e-commerce enabler in term of trading, product creating, and e-commerce servicing.
I. Job Descriptions
 Data analyst and reporting
Provide specialized analysis of the value chain, connecting information from Sales - Marketing - Supply Chain in order to provide operational reports on the current situation, offer suggestions for improvement, or respond to critical business problems. Analyze datasets to extract actionable insights, identify trends, patterns, opportunities for improvement in operational processes, and make data-driven recommendations.
Prepare customizable reports and dashboards to communicate key findings, insights, and recommendations to stakeholders. 
Collaborate with operations managers and stakeholders to understand business requirements and priorities.
Identify key performance indicators (KPIs) and metrics to measure operational performance and track progress over time.
Guarantee the most dependable, fastest, and unified data source for the entire company. (Single source of truth).
 Others task:
Other tasks assigned by the Line manager.
Ii. Requirements
 Knowledge
Bachelor in Statistics, Business, Data Analytics, and other related fields.
Knowledge of research methodologies. Ability to conduct research, prepare comprehensive reports, and present complex financial and statistical information in a clear and succinct format.
 Skills
Proficient in SQL, Python, and Power BI.
Strong communication skills, be able to express your ideas clearly in Vietnamese and English.
Strong collaboration and facilitation skills, willingness to learn, teamwork mindset, multitasking, and ability to lead and drive a group to make decisions.
Ability to demonstrate a high level of verbal and written communication to coordinate with internal stakeholders across departments.
Ability to work independently and proactively, ability to provide creative and effective solutions.
Good at using MS Office: Powerpoint, Excel, Doc.
 Experience
At least 1 year of experience in a relevant role.
Experience in e-commerce industries is a plus.
III. WHY YOU WILL LOVE JOINING US?
 FOR YOU TO JOIN
Financial Well-being: A competitive salary with 13th month salary, annual performance bonus and a variety of allowances.
Salary review: annually or on excellent performance.
Activities: company trips, team-building, and other customized monthly bonding events.
Annual leaves: 16 days off and 01 Birthday Leave per year.
Healthcare: annual health check, insurance according to Labor Law and extra PTI Insurance package.
Working Environment: dynamic, friendly environments with working time flexibility (Mon-Fri), and other perks include snacks, coffee, and healthy food provided daily suited for hardworking, fun, and team collaboration.
 FOR YOU TO GROW
Ambition: We are now keeping on with our hyper growth to multicategory, multichannel, multimarket, and expanding into the world largest e-commerce enabler. Hence, there will continuously be opportunities to challenge yourself, learn new skills and knowledge.
Challenges: Your voice can always be heard as we embrace the eagerness of learning and sharing. You can be your own boss and create your own value with the ability to take initiative and make decisions in all aspects of work.
Chances: Be led and coached by experienced and inspirational leaders and participate in various training courses where you can enlarge your knowledge and experience in the E-commerce and Supply Chain industry.
 FOR YOU TO STAY
People: Having a headquarter in the US and an operation office in Vietnam, our team is young and highly motivated. You will be working with and alongside members having experiences from International Corporations or high profile from Vietnam that share the same passion and dedication.
Culture: Our working environment is humble, collaborative and 100% healthy. We promote Exchange & Speak out, you can receive transparent and supportive feedback so you can perform the best.
Career path: Provide you a great career path, open to rotating for your better understanding of the company and contribute across many of our functions.
And much more, join us and let yourself explore other fantastic things!"
4149383460,Data Collector,Aceolution,"Ho Chi Minh City, Vietnam",2 weeks ago,,"Aceolution is urgently seeking for 
Field Data Representatives
 in 
Vietnam 
(Hanoi & Ho Chi Minh City) who will verify points of interest (POI) based on specific survey instructions. This will involve walking in assigned locations.
However, workers are free to use bike/scooter/other transport if he/she wants.
Employment Type: Regular, full-time. Monday to Friday
Contract period: 10 Days work+ 1day training
Individual Insurance Eligibility: English (Read and speak)
Must live in Hanoi & Ho Chi Minh City, Vietnam.
Nature of work: 
Pedestrian verification of POIs (Point of Interest) which can be amongst hotels, gas stations, restaurants and the likes. We’ll provide: - The list of facilities to verify + the point layer with locations - Survey instructions - Mobile app (Android/iOS) that works on Android 10 and iOS The surveyor will need to walk to the POI and check/collect some information that may involve 5-10 parameters about it and take a picture of the entrance. We recommend on-feet collection; however, workers are free to use bike/scooter/other transport if he/she wants.
Job Type: 
Contractual / Temporary
Contract length: 
10 days
Pay: 
$3.5 per hour
Work Location:
 In person"
4161462683,Category Management Analyst,Shopee,"Ho Chi Minh City, Ho Chi Minh City, Vietnam",5 days ago,,"Job Description
Translate data into valuable insights and present results and recommendations 
Proactively identify new commercial opportunities through deep analysis and innovative research methods
Evaluate market conditions and competitor data to identify emerging trends and to recommend learnings and action points to optimize results
Regularly review and analyze key commercial metrics to develop report, drive continual optimization and improve campaign efficiency
Provides data-driven, actionable insights and recommendations for improving commercial & investment performance
Coordinate and liaise with functional stakeholders to run category and/or cluster projects on demand
Requirements
Minimum Bachelors Degree in Marketing, BBA or related fields from well-known universities
2 - 3 years experienced, e-commerce industry would be a plus
Strong communication skills in both written and verbal format
Efficient command of Business English
Strong project management skills
Good team player, positive attitude and eager to learn
Creative, well-organised and self-motivated
Proficiency in Microsoft Excel, Word and PowerPoint
Strong ability to visualize data/insight
Experience in PowerBI and query tools is an advantage"
4115969894,"Associate, Business Intelligence-HCMC - Vietnam",Lazada,"Ho Chi Minh City, Vietnam",2 weeks ago,,"Be the expert in using data to measure and analyze business performance in each our markets and lines of business
 Monitor key metrics and alert the business on potential issues
 Design market/business intelligence reports and performance measurement dashboards to share with senior management
 Develop and automate reports, interactively build and prototype dashboards to provide insights at scale, solving for analytical needs
 Collaborate with cross-functional stakeholders to understand their business needs, formulate and complete end-to-end analysis that includes data gathering, analysis, ongoing scaled deliverable and presentations
 Perform ad-hoc analysis to drill down into certain business challenges, providing conclusions and advice based on data analysis
 Support projects on data projection, data analysis, performance tracking, and to summarize data analysis requirements
 Support to colleagues for understanding data insights and handling basic data analysis skills
Job Requirements
 Experience in analytics, project management, strategy and/or tech consulting, or other related fields. Experience in E-commerce is a plus.
 Sharp critical thinking, strong analytical and numerical skills. Good communication skills
 Eager to work in a fast-paced and ambiguous environment
 Solid knowledge of SQL and other programming language. Hands-on experience in data extraction, cleaning, preparation, and dashboard development
 Highly energetic and self-motivated. Willingness to learn attitude with ability to work under pressure
 Bachelor’s or Master's degree in relevant field of study."
